{
  "discovery" : {
    "families" : {
      "bacnet" : { },
      "vendor" : { }
    }
  },
  "localnet" : {
    "families" : {
      "bacnet" : { },
      "ether" : { },
      "ipv4" : { },
      "vendor" : { }
    }
  },
  "notifs" : {
    "notif_id" : { }
  },
  "pointset" : {
    "points" : {
      "filter_alarm_pressure_status" : {
        "ref" : "BV/11#present_value",
        "units" : "No-units"
      },
      "filter_differential_pressure_sensor" : {
        "ref" : "AV/12#present_value",
        "units" : "Degrees-Celsius"
      },
      "filter_differential_pressure_setpoint" : {
        "set_value" : 98,
        "units" : "Bars"
      }
    },
    "sample_rate_sec" : 300
  },
  "system" : {
    "metrics_rate_sec" : 10,
    "min_loglevel" : 100,
    "operation" : {
      "last_start" : "TIMESTAMP"
    },
    "testing" : {
      "sequence_name" : "basic_notification"
    }
  },
  "timestamp" : "TIMESTAMP",
  "version" : "@@@cloud udmi version###1.4.1"
}