{
  "gateway": {
    "target": {
      "addr": "2",
      "family": "modbus",
      "network_id": "modbus_rtu_1"
    }
  },
  "pointset": {
    "sample_rate_sec": 30
  },
  "system": {
    "metrics_rate_sec": 10,
    "min_loglevel": 300,
    "operation": {}
  },
  "timestamp": "2020-05-01T13:39:07Z",
  "version": "1.5.3"
}
